{"reviewStatus":"pass_with_warnings","reviewedArtifact":{"sourceEmployee":"unknown","artifactType":"generic_json_artifact","artifactId":"dept-2026-08-18T025944Z-plan-qa-input-round-0","artifactPath":"reports/department/dept-2026-08-18T025944Z/dept-2026-08-18T025944Z-plan-qa-input-round-0.json"},"findings":[{"category":"actionability","severity":"info","description":"Tanto changePlans (nivel raiz) como webEngineerOutput.changePlans estan vacios: no existe ningun ChangePlan con beforeValue/afterValue que revisar plan a plan como pide la instruccion de QA. Es coherente con el fallo de lectura de staging declarado en implementationSummary ('la lectura de staging.zentrylockers.com fallo por red'), pero implica que esta ronda no produce ningun artifact ejecutable, solo una especificacion pendiente."},{"category":"unsupported_claims","severity":"warning","description":"dependencies[1] afirma que 'la evidencia de esa aprobacion es autorreferencial dentro de este contexto (asi lo senala QA)', atribuyendo esa observacion a una revision de QA previa, pero previousCorrections viene vacio en este mismo artifact -- no hay ninguna correccion o nota de QA anterior dentro del contexto suministrado que respalde esa atribucion."},{"category":"fabrication_risk","severity":"warning","description":"unknowns incluye la ruta especifica 'scripts/o291-resolve-melamina-cannibalization.ts (o equivalente)', un nombre de fichero concreto que no aparece en ninguna otra parte del contexto suministrado (la evidencia solo menciona 'script ya aprobado O29.1'). Aunque esta enmarcado como pregunta sin confirmar, introducir un path de repositorio plausible pero no sourced en el propio artifact es un riesgo de fabricacion, aunque de bajo impacto por estar explicitamente marcado como no verificable."},{"category":"approval_requirements","severity":"info","description":"approvalRequired:true es coherente con el contenido: ninguna de las 10 recomendaciones tiene ChangePlan ejecutable, la propuesta de /taquillas-para-hospitales/ (rec-7) se identifica explicitamente como sin aprobacion humana previa, y el cambio sobre la version live de GTM se condiciona correctamente a 'confirmacion explicita y trazable... de la persona responsable (Pau)' antes de publicar o revertir."},{"category":"evidence_coverage","severity":"info","description":"Cada una de las 10 approvedRecommendations tiene una entrada correspondiente en proposedChanges cuya rationale cita el titulo exacto de la recomendacion que dice resolver, y acceptanceCriteria/validationPlan/rollbackPlan cubren de forma especifica cada uno de esos 10 puntos -- buena trazabilidad interna."}],"unsupportedClaims":["dependencies[1]: 'la evidencia de esa aprobacion es autorreferencial dentro de este contexto (asi lo senala QA)' -- no hay ninguna entrada en previousCorrections (vacio) que respalde que QA senalo esto previamente dentro de este artifact."],"contradictions":["dependencies[1] atribuye una observacion a 'QA' ('asi lo senala QA') mientras que previousCorrections del propio artifact esta vacio, sin ninguna correccion de QA previa registrada que la origine."],"safetyConcerns":[],"requiredCorrections":["Aclarar o eliminar la referencia 'asi lo senala QA' en dependencies, o citar explicitamente en que correccion previa de QA se basa, dado que previousCorrections esta vacio en este artifact.","Marcar explicitamente como hipotesis no confirmada (o retirar) el nombre de fichero 'scripts/o291-resolve-melamina-cannibalization.ts' en unknowns, ya que no proviene de ninguna evidencia citada en el resto del contexto suministrado."],"correctionRequests":[],"approvalRecommendation":{"recommendedStatus":"pending","riskLevel":"medium","rationale":"No hay ningun ChangePlan ACTIONABLE (changePlans:[] tanto a nivel raiz como en webEngineerOutput), por lo que esta ronda no escribira nada automaticamente en staging ni produccion; el riesgo inmediato de ejecucion es bajo. Sin embargo, la especificacion propone acciones que, cuando se conviertan en ChangePlans, tocaran sistemas externos (GTM, configuracion de conversiones en GA4) y contenido publicado (metas, on-page, landing nueva), por lo que el riesgo del programa completo es medio y requiere decision humana explicita en varios puntos: repetir la lectura de staging, confirmacion de Pau sobre GTM, aprobacion nueva para /taquillas-para-hospitales/ y verificacion independiente de que las 5 correcciones del 2026-08-16 realmente se aplicaron."},"evidence":["implementationSummary: 'Esta pasada coordinada no aporta ChangePacks ni inventario de staging (la lectura de staging.zentrylockers.com fallo por red), por lo que ninguna de las 10 recomendaciones aprobadas por Growth+QA puede resolverse contra una pagina verificada ni convertirse en un changePlan ejecutable.'","Campo raiz 'changePlans': [] y 'webEngineerOutput.changePlans': [] -- ambos vacios, sin ningun ChangePlan con beforeValue/afterValue.","proposedChanges[1].description: 'Confirmar con el responsable humano (Pau)... publicarla o revertirla segun corresponda tras esa confirmacion.'","dependencies[1]: 'la evidencia de esa aprobacion es autorreferencial dentro de este contexto (asi lo senala QA) y ademas los datos live de hoy sugieren que no se aplicaron' vs 'previousCorrections': [] (vacio) en el mismo artifact.","unknowns[3]: 'Si el script scripts/o291-resolve-melamina-cannibalization.ts (o equivalente) existe realmente, en que estado esta y si es seguro ejecutarlo -- no puedo confirmar rutas de repositorio.'","approvalRequired: true.","proposedChanges[6].rationale (rec-7 taquillas-para-hospitales): 'esta propuesta NO tiene aprobacion humana previa registrada en este contexto y requiere esa aprobacion antes de cualquier trabajo.'"],"summary":"El artifact es una especificacion de ingenieria (sin ChangePlans ejecutables: changePlans vacio en ambos niveles) motivada por un fallo de lectura del inventario de staging, y cubre correctamente las 10 recomendaciones aprobadas con trazabilidad clara, riesgos, dependencias y unknowns bien documentados. No hay hallazgos criticos ni acciones inseguras porque nada es ACTIONABLE todavia, pero se detectan dos problemas menores: una atribucion a 'QA' no respaldada por previousCorrections (vacio) y un nombre de fichero de script inventado/no sourced en unknowns. Recomiendo mantener la decision en manos humanas (pending) dado que el programa completo, una vez con ChangePlans reales, tocara sistemas externos (GTM, GA4) y contenido publicado."}